{
  "$schema": "../../../../schemas/swarm-recipe-v1.schema.json",
  "formatVersion": 1,
  "contractStatus": "contract-only",
  "id": "fixture-research",
  "version": "1.0.0",
  "description": "Valid read-only Recipe fixture.",
  "readOnly": true,
  "budget": { "maxDepth": 1, "maxConcurrency": 2, "maxChildren": 2, "childTimeoutSeconds": 900, "runTimeoutSeconds": 1800, "retry": 0, "nestedSwarm": false, "childOutputBytes": 51200, "parentSummaryBytes": 8192 },
  "writerPolicy": { "sharedCwdMaxWriters": 1, "parallelWriters": "managed-worktree-only", "onConflict": "reject" },
  "nodes": [
    { "id": "research", "agent": "scout", "taskTemplate": "research-source", "needs": [], "workspace": "shared-read-only", "writer": false, "timeoutSeconds": 900, "retry": 0 },
    { "id": "verify", "agent": "scout", "taskTemplate": "verify-source", "needs": ["research"], "workspace": "shared-read-only", "writer": false, "timeoutSeconds": 900, "retry": 0 }
  ],
  "aggregation": { "strategy": "verified-synthesis", "order": "topological-then-node-id", "includePartial": false, "maxOutputBytes": 65536 },
  "verifier": "verify",
  "cancellation": { "stopAdmission": true, "cancelRunning": true, "disableRetry": true, "waitForTerminalProof": true }
}
